{
  "schema_version": "1",
  "member_id": "00000000-0000-4000-8000-000000002801",
  "knowledge_run_id": "00000000-0000-4000-8000-000000002802",
  "generated_at": "2026-09-01T01:02:03Z",
  "summary": {
    "total_contracts": 2,
    "evidence_ready_contracts": 0,
    "documents_pending_contracts": 1,
    "link_review_required_contracts": 1,
    "conflict_contracts": 0,
    "orphan_operational_contracts": 1,
    "unresolved_unreadable_sources": 1
  },
  "contracts": [
    {
      "knowledge_contract_id": "00000000-0000-4000-8000-000000002803",
      "insurer_display": "Sample Insurer",
      "product_display": "Sample Policy A",
      "certificate_decision": "MATCH",
      "current_status": "unknown",
      "reconciliation_state": "DOCUMENTS_PENDING",
      "operational_link": {
        "id": "00000000-0000-4000-8000-000000002804",
        "policy_contract_id": "00000000-0000-4000-8000-000000002805",
        "decision": "MATCH",
        "conflict": false,
        "authority": "USER_CONFIRMED_OPERATIONAL_IDENTITY",
        "reason_code": "USER_CONFIRMED_SAME_CONTRACT",
        "confirmed_at": "2026-09-01T01:00:00Z"
      },
      "document_readiness": {
        "policy_contract_id": "00000000-0000-4000-8000-000000002805",
        "completeness": "CERTIFICATE_ONLY",
        "has_product_explanation": false,
        "has_application": false
      }
    },
    {
      "knowledge_contract_id": "00000000-0000-4000-8000-000000002806",
      "insurer_display": "Sample Insurer",
      "product_display": "Sample Policy B",
      "certificate_decision": "MATCH",
      "current_status": "active",
      "reconciliation_state": "LINK_REVIEW_REQUIRED",
      "operational_link": {
        "id": null,
        "policy_contract_id": null,
        "decision": "UNKNOWN",
        "conflict": false,
        "authority": null,
        "reason_code": "NO_EXACT_BINDING",
        "confirmed_at": null
      },
      "document_readiness": null
    }
  ],
  "orphan_operational_contracts": [
    {
      "policy_contract_id": "00000000-0000-4000-8000-000000002807",
      "insurer_display": "Sample Insurer",
      "product_display": "Operational Policy",
      "status": "unknown",
      "completeness": "CERTIFICATE_AND_TERMS"
    }
  ],
  "unresolved_sources": [
    {
      "document_batch_item_id": "00000000-0000-4000-8000-000000002808",
      "source_kind": "policy",
      "display_label": "보험증권 문서",
      "processing_state": "PASSWORD_REQUIRED",
      "current_resolution_id": null
    }
  ]
}
